Keyword Searched,Title,Content,URL
tariffs,Have Trump’s tariffs killed US-Africa preferential trade?,"United States President Donald Trump’s tariffs announcement on most trading partners, including several in Africa, will affect businesses and people across the continent and likely force more producers to trade with China, experts have warned.

Trump’s “Liberation Day” declaration on Wednesdaythrew markets into chaos, as the US took its strongest turn to protectionist policies since the 1930s, weakening a global trade system the US helped build and strengthen.

The tariffs,which include a baseline, universal 10 percent duty on all US imports as well as additional tariffs on “worst offender” countries like Nigeria and South Africa, will also likely override a decades-long open trade agreement that has seen African manufacturers export goods to the US duty-free and that has been credited for creating tens of thousands of jobs, analysts say.

Established in 2000, the African Growth and Opportunity Act (AGOA) framework helped grow the continent’s exports of textiles, steel, and agricultural products, among others, to the US.

The AGOA was set for a second renewal this year, but is now likely to be jeopardised by Trump’s trade war, according to analysts.

Here’s what to know about how African countries were hit and what the likely effects could be:

Africa’s largest economies, Nigeria (14 percent) and South Africa (31 percent), were among those on Trump’s “reciprocal” tariffs list — that is, countries the president said “treat us badly”.

They included those that impose high tariffs on US goods or have introduced other barriers to US trade, according to Washington. Those tariffs will take effect on April 9, while the universal tariffs begin on April 5.

Southern African countries were particularly badly hit. Lesotho, the small Southern African country that Trump claimed “ no one has heard of” last month, was hit with thehighest tariff ratesat 50 percent. The country, which carries the second-highest HIV burden of any other in the world, is still reeling from the shock of Trump’s sweeping aid cuts earlier that have gutted HIV response efforts across the region.

Other Southern African countries hit were: Madagascar (47 percent); Mauritius (40 percent); Botswana (37 percent); and Angola (32 percent).

South Africa was also earlier affected by a separate 25-percent tariff on all foreign-made cars that went into force this week. South Africa exports vehicles and parts worth $2bn to the US under the AGOA framework, according to the country’s Ministry of Trade, Industry and Competition.

Here are the tariffs in excess of 10 percent imposed on other African countries:

South Africa’s government, which has been involved in a series of spats with Washington in recent weeks, was the first to respond to the tariff hikes.

In a statement on Thursday, President Cyril Ramaphosa’s office called the tariffs on the country “punitive” and added that they would “serve as a barrier to trade and shared prosperity.” The government also pledged to seek redress with Washington.

The Presidency has noted with concern the newly imposed tariffs on South African exports to the United States of America (USA).https://t.co/Y3YgJd7ECP

— The Presidency 🇿🇦 (@PresidencyZA)April 3, 2025



“The tariffs affirm the urgency to negotiate a new bilateral and mutually beneficial trade agreement with the US, as an essential step to secure long-term trade certainty,” the statement read.

According to the US government, South Africa charges a 60 percent tariff on US goods, while Lesotho charges 99 percent. Madagascar, the White House claimed, levies 93 percent tariffs on US goods, and Mauritius, 80 percent.

Trump and his close ally, Elon Musk, who was born in South Africa, have criticised South Africa for land reform policies that they claim discriminate against the country’s white minority population. Trump has also offered citizenship to white South Africans. On Wednesday, during his announcement, Trump said, “Bad things are going on there.”

Experts say the tariffs will most significantly impact African economies that are reliant on US trade, and that they will effectively overrideAGOAprivileges. Currently, 32 African countries are eligible for the programme. Countries can be, and have been, taken off the list – such as Niger and Gabon, which lost their benefits after military coups.

The AGOA, which expires in September, grants duty-free access to more than 1,800 products from eligible sub-Saharan African countries and has formed the backbone of US-Africa trade policy for 25 years. It was renewed for 10 years in 2015. Chocolate and basket-weaving materials from Mauritius, musical instruments from Mali and nuts from Mozambique are among the products that have reached US buyers through AGOA.

While it is still officially operational, it’s unclear if the Trump administration will renew it again. Certainly, Trump’s tariff announcements “set it along the path to die”, Cheta Nwanze, lead partner at Lagos-based risk analysis firm SBM Intelligence, told Al Jazeera.

“African countries aren’t known for making firm geopolitical stances, so many of them will try to hold on to AGOA, which means it will go into zombie mode rather than dying off,” he said.

The programme has been hailed by economists for years for opening the US market to African manufacturers, although critics say its strict production and packaging requirements often favour bigger economies. Kenya’s AGOA sales, mainly textiles and apparel, went from $55m in 2001 to $603m in 2022.

South Africa and Nigeria are the top US trading partners on the continent. South Africa primarily exports precious stones, steel products, and cars (mainly from BMW South Africa) to the US. Nigeria exports crude oil and other petroleum products. In return, the US exports crude oil, electrical goods and aircraft to South Africa, and mostly vehicles and machinery to Nigeria.

Ghana (cocoa and crude), Ethiopia (coffee), and Kenya (textiles, tea) also record large volumes of trade with the US annually under the AGOA. Though not listed as “offenders”, these countries face the 10 percent universal tariffs.

Heavier tariffs would have varying but largely negative impacts on African manufacturers, analysts say, and could lead to increased living costs and a loss of jobs that would affect the general populace.

“Increased export costs would reduce competitiveness, potentially decreasing revenue and destabilising economies,” Nwanze of SBM Intelligence told Al Jazeera.

Sectors such as the agricultural and mineral extraction businesses are likely to be particularly vulnerable, he added, as most African manufacturers sell raw goods, not finished products, to the US.

Nigeria is still in the throes of a cost-of-living crisis that has led to high levels of hunger and poverty. South Africa, meanwhile, already records some of the highest levels of unemployment in the world, with an estimated six out of 10 people out of a job. Experts there had earlier estimated that a 25-percent blanket tariff would be a “worst case scenario”.

Speaking to the South African publication IOL before Trump’s announcement, Casey Sprake, an economist at South African investment firm Anchor Capital, said a 25-percent scenario could cut the country’s economic growth by between 0.2 and 0.3 percentage points. The country ended up with 31 percent.

In the short term, countries like South Africa appear to want to reason with Trump for more favourable terms.

In a statement earlier this week, Trade Minister Parks Tau said the country was urgently seeking a meeting with Washington. Tau noted that South Africa’s automobile exports account for only 0.99 percent of total US automobile imports and 0.27 percent of auto parts – figures he said hardly posed a threat to the US market.

In general, African nations are likely to turn to alternative trade partners, such as China, to avoid US tariffs, Nwanze added. Already, for nearly 20 years, China has overtaken the US as Africa’s top trading partner and represents one of the continent’s largest bilateral lenders.

China imports primary goods, such as crude oil, iron ore, copper, and is increasingly focusing on agricultural produce, as well. On the other hand, the country exports finished products, such as electronics, back to the continent.







",https://www.aljazeera.com/news/2025/4/4/have-trumps-tariffs-killed-us-africa-preferential-trade
tariffs,"China, US hold talks on tariffs in first bid to de-escalate trade war","China’s trade envoy He Lifeng has met United States Treasury Secretary Scott Bessent in Switzerland for talks aimed at easing atrade warbetween the superpowers that is roiling global markets.

The first official engagement, since the US slapped a 145 percent tariff on Chinese goods, prompting a retaliatory 125 percent duty from China, began on Saturday at an undisclosed location in Geneva, Switzerland, according to the Chinese state news agency Xinhua.

A motorcade of black cars and vans was seen leaving the home of the Swiss ambassador to the United Nations in the suburb of Cologny, The Associated Press news agency reported.

A diplomatic source, speaking to AP on condition of anonymity because of the sensitivity of the meeting, said the sides met for about two hours before departing for a previously arranged luncheon.

The trade dispute, which effectively amounts to a mutual boycott of products, was prompted by US PresidentDonald Trumplast month when he announced sweeping duties on almost every country in the world, which are now subject to a 90-day reprieve while negotiations take place.

Experts believeChinamay be looking for the same 90-day waiver as well as a reduction of the 145 percent tariff – Trump suggested that it could be reduced to 80 percent, saying in a Truth Social post on Friday that the amount “seems right”.

Trump’s press secretary, Karoline Leavitt, said on Friday that the US would not lower tariffs unilaterally, adding that China would need to make concessions as well.

Bessent has said the meetings in Switzerland would focus on “de-escalation”.

“The best scenario is for the two sides to agree to de-escalate on the … tariffs at the same time,” said Sun Yun, director of the China programme at the Washington, DC-based Stimson Center, adding even a small reduction would send a positive signal.

“It cannot just be words,” she said.







Trump has justified the punitive tariff by citing unfair trade practices and accusing Beijing of failing to curb the export of chemicals used to produce fentanyl, a lethal synthetic opioid.

China, for its part, says it will not bow to “imperialists” and bullies.

With distrust running high, both sides have been keen not to appear weak, and economic analysts have low expectations of a breakthrough.

Trump has suggested the discussions were initiated by China. Beijing said the US requested the discussions and that China’s policy of opposing US tariffs had not changed.

Swiss Economy Minister Guy Parmelin met both parties in Geneva on Friday and said the fact that the talks were taking place was already a success.

“If a roadmap can emerge and they decide to continue discussions, that will lower the tensions,” he told reporters on Friday, saying talks could continue into Sunday or even Monday.",https://www.aljazeera.com/news/2025/5/10/us-and-chinese-officials-hold-geneva-talks-to-de-escalate-trade-war
tariffs,Trump-Amazon spat: What happened and how much US consumers import online,"The White House on Tuesday accused Amazon of committing a “hostile and political act” by planning to list extra tariff costs on its website. Amazon has disputed the allegation, saying it is not planning to display any added trade charges.

At a news conference marking President Donald Trump’s first 100 days in office, White House Press Secretary Karoline Leavitt lashed out at Amazon over news reports that suggested the company was considering displaying theadded cost of tariff dutieson its online platform.

“Why didn’t Amazon do this when the Biden administration hiked inflation to the highest level in 40 years?” Leavitt asked.

She further attacked the company by saying that “Reuters recently wrote [that] Amazon partnered with a Chinese propaganda arm,” holding up what appeared to be a news article printout.

Though Amazon denied the White House’s allegation, its stock pricesank brieflyfollowing Leavitt’s comments before recovering again shortly afterwards.

The White House’s tirade against the retail giant is an indication of the pressure it is facing over Trump’s new tariffs –145 percentin the case of China and 10 percent on all other countries – which analysts say will lead to higher prices.

And while Amazon says it won’t proactively expose the tariffs as the reason prices are rising, other major online retailers aren’t as skittish.

On Tuesday,Punchbowl Newsreported that Amazon will soon “display how much of an item’s cost is derived from tariffs – right next to the product’s total listed price,” to illustrate how Trump’s tariffs are affecting thecost of goods.

The Trump administration’s fierce reaction to the Punchbowl article appeared to be based on a misinterpretation of internal plans being considered by Amazon, rather than any final decision.

Less than an hour after Leavitt’s news briefing, Amazon issued a statement saying that, though one of its teams had discussed “the idea of listing import charges on certain products,” it was “never a consideration for the main Amazon site”.

Only Amazon’s Haul service – its recently launched, low-cost storefront – “considered the idea” of listing import charges on certain products, a company spokesperson told The Associated Press news agency. But he said this “is not going to happen”.

The AP also reported that Trump called Amazon founder Jeff Bezos to complain about the reported plans on Tuesday morning. The administration seemed to change its tune after the conversation.

“Jeff Bezos was very nice. He was terrific,” Trump told reporters before leaving the White House for Michigan on Tuesday afternoon. “He solved a problem very quickly and he did the right thing. He’s a good guy.”

Trump’s tariffs – and the retaliatory responses from targeted countries,notably China– threaten to increase prices for online retailers and, by extension, American consumers. Amazon won’t be spared.

Amazon’s United States revenues topped $600bn last year. Its core business offering is to charge third-party sellers to use its website, and then leverage those commissions to fund its vast delivery infrastructure.

In 2024, 83 percent of US households shopped with Amazon. The retail giant has, in recent years, adjusted its focus from selling big-ticket items like TVs and gaming consoles to everyday goods like laundry detergent and toilet paper.

Revenues, in turn, have gone up. In 2023, Amazon processed 5.9 billion delivery orders in the US, a whopping 15.7 percentage point increase in a single year. Its share of the US parcel market also rose by 16.3 percentage points from 2022 levels.

In the US, Amazon makes roughly 40 percent of e-commerce sales. Its business model relies heavily on third-party merchants, many of whom are based in China – they can offer bargain prices due to low manufacturing and regulatory costs.

A staggering 71 percent of the goods sold by Amazon in the US are manufactured in China, according to a 2024 survey by Jungle Scout. For context, that’s 2.5 times more than the number of products sourced from the US.

Third-party sellers are now faced with a choice of either raising prices or absorbing the extra costs of Trump’s tariffs. It’s an existential threat for many merchants, who subsist on razor-thin margins. E-commerce is going to take a hit.

Numerous online retailers have decried Trump’s trade moves. Several big-name companies including Amazon’s rivals Temu and Shein have already raised prices while specifically pointing to the costs of tariffs.

Earlier this month, Temu and Shein said in separate but nearly identical notes that their operating expenses had gone up “due to recent changes in global trade rules and tariffs”. They both announced that price hikes would take effect on April 25.

Temu, owned by the Chinese e-commerce company PDD Holdings, now lists added “import charges”, which have reportedly doubled many items’ prices, although those available in local warehouses currently appear to be exempt.

Meanwhile, Shein, which is focused on fast fashion and based in Singapore, has a checkout banner that now reads, “Tariffs are included in the price you pay. You’ll never have to pay extra at delivery.”

Though Temu and Shein have experienced rapid growth in recent years – they were the top two most downloaded apps in the US in 2023 – their share of America’s e-commerce market remains much smaller than Amazon’s.

Still, their exposure to tariffs on Chinese imports remains just as significant.

According to a 2023 investigation by the US House Select Committee, nearly half of Temu and Shein’s goods shipments to the United States originated from China – amounting to approximately 600,000 packages per day.​

Like other e-commerce firms, Temu and Shein are attempting to move some production lines to the US, as well as stocking more inventory there. But these measures won’t be enough to prevent Americans from swallowing higher prices.

Last week, the International Monetary Fund (IMF) said that Trump’s unpredictable tariff policy and countermeasures by America’s trading partners will likely deal aheavy blowto US prosperity.

At the start of the year, the IMF expected the American economy to grow at 2.7 percent in 2025. Following the announcement of Trump’s “liberation day” tariffs, the fund lowered its projection to 1.8 percent.

The IMF has also grown gloomier on consumer prices and now sees US inflation hitting 3 percent this year, compared with its January forecast of 2 percent. Much of that rise will be felt in the form of Chinese imports.

On April 16, the US Federal Reserve Chair Jerome Powell warned that Trump’s tariffs were generating a “challenging scenario” for the central bank and were likely to generate higher inflation.

Powell added that Trump’s tariffs were likely to cause “at least a temporary rise in inflation”. He also suggested that “the inflationary effects could also be more persistent”.

A recent Reuters/Ipsos poll showed that public approval of the president’s economic management has fallen to 37 percent, his lowest-ever score in that survey.",https://www.aljazeera.com/news/2025/4/30/trump-amazon-spat-what-happened-and-how-much-us-consumers-import-online
tariffs,Imposing tariffs on China will not help resolve the US fentanyl crisis,"On February 1, the United States government announced a new 10 percent tariff on Chinese imports under the pretext of combatting the proliferation of the opioid fentanyl. The following day, the spokesperson of the Chinese Foreign Ministry stated that China firmly deplored and opposed this move and would take necessary countermeasures to defend its legitimate rights and interests.

Indeed, a new tariff is counterproductive not only when it comes to efforts to rein in the production and distribution of fentanyl but also for bilateral trade relations.









The US is one of the largest consumers of fentanyl-based drugs in the world and in recent years, their abuse has exacerbated drug addiction and caused many deaths. The crisis has its roots in longstanding opioid use patterns in the country, the profit-driven nature of the US pharmaceutical industry, inadequate public awareness and ineffective social governance.

China has some of the world’s toughest counternarcotics policies and laws. In the spirit of humanity and goodwill, China has given support to the US’s response to this issue. At the US’s request, China announced back in 2019 the decision to officially schedule fentanyl-related substances as a class. China has conducted counternarcotics cooperation with the US side in such fields as the scheduling of drug-related substances, intelligence sharing, and cooperation on individual cases.

Yet, the US still insists on dramatising the issue and accuses China of driving its fentanyl crisis. But scapegoating other countries for a domestic crisis will not make the problem disappear; tariffs certainly will not.

The unilateral sanctions imposed by the US risk weakening its anti-drug cooperation with China and may also force fentanyl precursor transactions to be conducted on the black market or through third countries, making law enforcement even more difficult.

Furthermore, these unilateral sanctions imposed violate the basic principles of the World Trade Organization (WTO), of which both China and the US are members. According to the 1947 General Agreement on Tariffs and Trade (GATT) – the precursor to the WHO – trade shall be conducted in a non-discriminatory manner.

However, the unilateral sanctions imposed by the US on specific countries or enterprises essentially constitute discriminatory treatment. This undermines fair competition among WTO members and poses a potential threat to multilateral trade rules.

Additionally, the US practices violate the principle of national treatment laid out in Article III of GATT. The article requires that imported products must not be accorded unfavourable treatment based on their origin after entering the territory of a WTO member. The sanctions the US imposed may directly restrict the import of legal drugs or their precursor chemicals, resulting in discrimination against imported goods from China.

The US may seek to justify its unilateral tariffs by citing threats to public health or national security, which under GATT can be used to justify tariffs. But to invoke GATT’s Article XX (“General Exceptions”) or Article XXI (“Security Exceptions”), the US would have to demonstrate not only the relevance and necessity of imposing tariffs to protect public health or national security, but also the absence of other less trade-distorting and equally effective means. Factors such as the complexity of the fentanyl crisis and domestic demand make it difficult for the exceptions to be applied.

The frequent use of unilateral sanctions by the US not only violates the core rules of the WTO but also disrupts the international trade order and multilateral cooperation. In particular, abusing exception clauses may prompt other countries to question the fairness and efficacy of WTO rules. The possible retaliation in response to US tariffs from other WTO members could lead to a global trade conflict and encourage the trend towards fragmentation of the global trading system.

In the long run, the US sanctions will backfire at home as well. Higher tariffs will result in increased prices for imported goods, increasing the burden on American consumers and undercutting the competitiveness of US companies globally.

The US needs to view and solve its own fentanyl issue in an objective and rational way instead of threatening other countries with arbitrary tariff hikes. Reducing domestic demand for drugs and enhancing law enforcement cooperation can be effective solutions to the fentanyl crisis.

Trade and tariff wars have no winners. Pressuring or threatening China is not the right way to engage, as my country will firmly defend its legitimate rights and interests.

Keeping business ties between China and the US robust serves the fundamental interests of both countries and both peoples, and benefits global economic growth. China hopes the US will work with it to address concerns through equal-footed consultation, maintain the hard-won positive dynamics in counternarcotics cooperation, and jointly promote the steady, sound and sustainable growth of bilateral trade and economic ties.

The views expressed in this article are the author’s own and do not necessarily reflect Al Jazeera’s editorial stance.",https://www.aljazeera.com/opinions/2025/2/26/imposing-tariffs-on-china-will-not-help-resolve-the-us-fentanyl-crisis
