Keyword Searched,Title,Content,URL
tariffs,How much will Donald Trump’s tariffs cost US families?,"United States President Donald Trump’s broad array oftariffs on foreign goodshas spooked consumers, businesses and the stock market. But what will the specific impact be for typical American consumers?

US Senate Minority Leader Chuck Schumer offered a figure on April 27 on CNN’s State of the Union.

The Democrat from New York said, as a candidate, Trump never fully explained to voters that tariffs wouldraise their costs. “It’s estimated it’ll raise the American costs … American families would have to pay about $4,000 more a year,” he said.

Calculating how typicalhouseholdswould be hit involves estimation and assumptions, especially given Trump’s frequent tinkering with what items will be tariffed and when. But Schumer’s figure is roughly in line with four independent estimates that PolitiFact identified.

Four of five estimates by groups with varying political ideologies range from $3,100 to $4,900 a year; the midpoint of that range is in line with Schumer’s figure. A fifth group estimated the cost to consumers would be $1,243.

The estimate variations stem from the groups’ differing assumptions about how the tariffs will be absorbed into the economy.

Schumer’s office did not respond to inquiries for this article.

We identified five estimates on Trump’stariffs’ effecton US families, based on the tariffs he imposed before April 2 (including those onCanada and Mexico), the 10 percent across-the-board tariffs on virtually every country, and the 145 percent tariff on China. The estimates do not include the impact of higher country-by-country tariffs that Trump announced on April 2 but paused for 90 days beginning on April 9.

Here are the estimates in descending order.

Yale Budget Lab:The most recent estimate from the nonpartisan Budget Lab at Yale University shows an average loss per household of $4,900. The lab also offered a more limited calculation that accounts for changes in consumer behaviour because of tariffs without factoring those in as losses; this worked out to a $2,600 loss per family.

The analysis found that low-earning families would be hit hardest. A family earning roughly $30,000 to $40,000 would lose 5.1 percent of its income, more than twice the proportional hit for a family earning well above $100,000.

Center for American Progress:The liberal group estimated an average loss of $4,600 annually.

American Action Forum:The centre-right think tank told PolitiFact that its pre-April 9 estimate of $3,900 loss per household remains a solid guess even though it was calculated using a 60 percent tariff on China, rather than the current 145 percent. Jacob Jensen, the group’s trade policy analyst, said tariffs as high as 145 percent curb consumer purchases so much that they tend to bring in less revenue than tariffs that are set at lower rates.

Urban Institute-Brookings Institution Tax Policy Center:The nonpartisan Tax Policy Center estimated that the average household loss would be $3,100.

Tax Foundation:The centre-right Tax Foundation put the average loss lower than the other four, at $1,243.

Erica York, the Tax Foundation’s vice president of federal tax policy, told PolitiFact that her group’s analysis has a more limited scope, encompassing households’ 2025 direct losses of income from higher taxes.

York said other groups’ estimates go beyond this, including loss in quality of life from having to switch to inferior products, factoring in the Federal Reserve’s monetary policy response or using 2026 – assuming that it produces a full year of impact – rather than 2025, when the tariffs will be in force for less than a full year.

Differing methods such as these would produce variations in numbers, she said, citing the Yale Budget Lab’s dual estimates as an example.







Schumer said “it’s estimated” that Trump’s tariffs will mean “American families would have to pay about $4,000 more a year”.

Calculating the tariffs’ impact requires guesswork and is complicated by Trump’s frequent pauses on certain tariffs.

Four independent groups’ estimates range from $3,100 a year to $4,900 a year on average. The fifth, using a more restrictive method, estimated a $1,243 loss.

Based on these estimates, the statement is accurate but needs additional information, so we rate it Mostly True.",https://www.aljazeera.com/news/2025/5/6/how-much-will-donald-trumps-tariffs-cost-us-families
tariffs,Trump’s reciprocal tariffs: How much will each country be hit?,"President Donald Trump on Wednesdayannounceda range ofreciprocal tariffstargeting almost all countries that the United States trades with, taking a sledgehammer to Washington’s longstanding advocacy of free trade and globalisation.

Trump’slatest tariffs, which build on a series of similar steps he has taken since returning to office on January 20, are going to hit the countries with which Washington has large trade deficits, or that impose heavy tariffs on US goods. In 2023, the US imports were worth $1.1 trillion more than its exports; no other country has as large a trade deficit as the US.

Trump’s reciprocal tariffs also target countries likeSyria, which has faced Israeli attacks since the overthrow of President Bashar al-Assad in December 2024, and Myanmar, which is reeling fromearthquake damage amid a civil war. They also target economies already struggling to balance their books, depending on loans from the International Monetary Fund, such asSri LankaandPakistan.

Here is how each country will specifically be targeted by Trump’s tariffs and the few sectors that are — for now — exempt from the penalties.

Trump announced the reciprocal tariffs in an executive order alongside an address in the Rose Garden at the White House on Wednesday. Trump had been describing April 2 as“Liberation Day”.

In the executive order, Trump said while the US trading policy has been built on the principle of reciprocity, taxes and barriers on US products by its trading partners had hurt the US.

The tariffs, he said, were a response. These reciprocal tariffs will come into effect on April 9.

During his address, Trump made the argument that the US is charging its trading partners with smaller tariffs compared with the tariffs and non-tariff barriers that the partners impose on the US.

“For decades, our country has been looted, pillaged, raped and plundered by nations near and far, both friend and foe alike,” Trump said.

Holding up a chart of the new reciprocal tariffs, Trump cited the example of China, which he claimed charged US products with an average 67 percent tariff. “We’re going to be charging [China with] a discounted reciprocal tariff of 34 percent,” he said. “They charge us, we charge them less. How can anybody be upset? They will be because we’ve never charged anybody anything.”

But the effective tariff on China will actually be higher — and some countries will now be tariffed higher than the duties they levy on US imports. Chinese goods will face a 34 percent reciprocal tariff in addition to the20 percent tariffthat Trump imposed earlier, bringing the overall tariff on Chinese goods to 54 percent, close to his campaign promise of 60 percent. In 2024, China was the second-largest trading partner of the US.

The White House released an annexe of 57 target countries, territories and blocs which will face the increased tariffs. These include:



Yes. Apart from the 57 on the list announced on Wednesday, Trump has also imposed a flat 10 percent tariff on products coming from almost all the other trading partners of the US.

He did this by invoking the International Emergency Economic Powers Act of 1977.

Some of the leading countries that will face this 10 percent tariff rate on all exports to the US include:

These tariffs will come into effect on April 5.

While Canada and Mexico were not on the list of countries slapped with the latest tariffs, both US neighbours already face heavy tariffs.

On February 1, Trump signed executive ordersimposing 25 percent tariffson all goods imported from Mexico and Canada. Those tariffs were suspended for a month after negotiations between Trump and the leaders of the two countries.

In early March, Trump resurrected those tariffs, but on March 6,exempted goodsthat fall under the United States-Mexico-Canada Agreement (USMCA) from these tariffs on March 6.

Non-USMCA-compliant energy and potash face a 10 percent tariff. All other non-USMCA-compliant products from Mexico and Canada continue to face 25 percent tariffs.

The White House on Wednesday reaffirmed that the tariffs on Mexico and Canada remain in place.

The exempt products include copper, pharmaceuticals, semiconductors, lumber articles, energy products and certain critical minerals that are unavailable in the US.

On March 26, Trump signed an executive order imposing 25 percent tariffs on auto imports and certain automobile parts. No additional tariffs on these products were announced on Wednesday.",https://www.aljazeera.com/news/2025/4/3/trumps-reciprocal-tariffs-how-much-will-each-country-be-hit
tariffs,Trump-China tariff war: Who’s winning so far?,"After United States President Donald Trump suspended his “reciprocal tariffs” on major US trading partners onApril 9, he ramped them up on China’s goods. US trade levies on most imports from China have climbed to 145 percent. Beijing retaliated with duties of its own, at 125 percent on US goods.

Trump has long accused China of exploiting the US on trade, casting his tariffs as necessary to revive domestic manufacturing and reshore jobs back to the US. He also wants to use tariffs to finance tax cuts. Most economists remain sceptical Trump will achieve his aims.

For now, the US and China are locked in a high-stakes game of chicken. The world is waiting to see which country will yield and which will stay the course. As Trump nears his first 100 days in office for the second time, here’s where the tariff war with China stands:

Trump recently played up the possibility of securing a trade deal with China. Last week, the US presidentsaidhis tariffs on China will “come down substantially” in the near future.

“We’re going to have a fair deal with China,” Trump told reporters on April 23, stirring hopes of a de-escalation. He also said his administration was “actively” negotiating with the Chinese side without elaborating.

On April 24, however, China’s Ministry of Commerce rebuffed president Trump’s remarks, saying there wereno talks taking placebetween the two countries.

“Any claims about the progress of China-US economic and trade negotiations are groundless and have no factual basis,” ministry spokesman He Yadong said.

While he insisted that Beijing won’t duck any economic blows from Washington, he also said the door was “wide open” for talks.

Last week, the Reuters news agency reported that China was evaluating exemptions for select US imports – a list of up to 131 products.

Beijing has not made any public statement on the issue.

Trump introduced his sweeping tariffs on China less than three weeks ago. The fallout for US businesses won’t be fully felt until later this year. Still, the warning signals are already flashing red.

Data from the US Department of Agriculture shows that exports of soya beans – the biggest US farm export – fell dramatically for the period April 11-17, the first full week of reporting since Trump’s China tariff announcement.

By April 17, net sales of US soya beans dropped by 50 percent compared with the previous week. That was driven by a 67 percent fall in weekly soya bean exports to China, which, until recently, was America’s biggest export destination for the legume.

According to Piergiuseppe Fortunato, an adjunct professor of economics at the University of Neuchatel in Switzerland, “China’s retaliatory tariffs will hit US farmers hard. Some may go out of business.” He added that all sectors with exposure to China would come under strain.

In 2023, the US exported roughly $15bn of oil, gas and coal to China. Losing that market would hit US energy firms.

Since the start of Trump’s tariff war, cargo shipments have plummeted. According to Linerlytica, a shipping data provider, Chinese freight bookings bound for the US fell by 30 to 60 percent in April.

The drastic reduction in shipping from America’s third largest trading partner – after Canada and Mexico – has not yet been felt. In May, however, thousands of companies will need to restock their inventories.

According to Bloomberg News, retail giants Walmart and Target told Trump in a meeting last week that shoppers are likely to see empty shelves and higher prices from next month. They also warned that supply shocks could roll out to Christmas.

Electronic appliances, such as TV sets and washing machines, made up 46.4 percent of US imports from China in 2022. The US also imports a lot of its clothing and pharmaceutical product ingredients from China. The price of these goods will begin to rise from next month.

On April 22, the International Monetary Fund raised its US inflation forecast to 3 percent in 2025, owing to tariffs – a full 1 percentage point higher than in January. The lender also lowered its US economic growth forecast and raised its expectation that the US will tip into recession this year.

Despite growing tensions between the US and China, Washington and Beijing remain major trading partners.

According to the Office of the US Trade Representative, the US imported$438.9bnin Chinese goods last year.

That amounts to roughly 3 percent of China’s total economic output, which remains heavily reliant on exports.

In a report shared with its clients this month, Goldman Sachs said it expects Trump’s tariffs to drag down China’s gross domestic product (GDP) by as much as 2.4 percentage points.

For their part, China’s top officials said the country can do without American farm and energy imports and promised to achieve a 5 percent GDP growth target for this year.

Zhao Chenxin, vice chairman of the National Development and Reform Commission, said that together with non-US imports, domestic farm and energy production would be enough to satisfy demand.

“Even if we do not purchase feed grains and oilseeds from the United States, it will not have much impact on our country’s grain supply,” Zhao said on Monday.

He also noted there would be limited impact on China’s energy supplies if companies stopped importing US fossil fuels.

In some ways, experts said, China has been preparing for this crisis.

Fortunato told Al Jazeera: “The US is one of China’s biggest export markets, so tariffs will slow GDP growth. But Beijing has played this smartly as it began diversifying its imports away from the US during the first Trump trade war” in 2018.

He also pointed out that “the US depends on China for up to 60 percent of itscritical mineralimports, used in everything from clean energy to military technology. The opposite flow simply isn’t there, so the US is more vulnerable.”

Trump has made little secret of his wish to conscript US allies into a trade war. The administration said it aims to strike free trade deals with the European Union, Great Britain and Japan.

More generally, reports suggest that Washington is asking trade partners to loosen their economic ties with China as a pre-condition for securing relief from Trump’s “reciprocal” tariffs.

Nevertheless, US allies seem largely opposed to any economic showdown with China. Last week, the European Commission said it has no intention of “decoupling” from China.

Elsewhere, UK Chancellor of the Exchequer Rachel Reeves recently told the Daily Telegraph newspaper: “China is the second biggest economy in the world, and it would be, I think, very foolish to not engage.”

Many countries are not in a position to abandon their trade ties with Beijing. The EU, in particular, has a huge trade deficit with China. Cutting off access to Chinese goods – both consumer products and inputs for industry – would bruise its already sluggish economy.

Across the developing world, China’s trade role is equally as crucial. Roughly a quarter of Bangladesh’s and Cambodia’s imports come from China. Nigeria and Saudi Arabia are similarly dependent on Beijing for their goods imports.

“It’s hard to see why countries would want to undermine their own business interests to try and reduce America’s trade deficit with China,” Fortunato said. “On this point, I think Trump has been short-sighted and may be forced to blink first on lowering tariffs with China.”

The Chinese Communist Party doesn’t need to worry about its next election cycle. Trump’s Republican Party does, so Beijing has the political upper hand in Trump’s trade war. Simply put, it has more time on its side.

For Trump’s party, his sabre rattling already looks politically costly. A newEconomist-YouGovpoll shows Americans reporting Trump’s economic actions have hurt them personally more than they’ve helped by a 30-point margin.

And public approval of the president’s economic management has been low for a while: It had fallen to 37 percent in aReuters-Ipsos pollpublished on March 31, his lowest score ever in that survey.

If Trump stays the course, it is likely that his approval ratings might fall still lower, jeopardising the Republican Party’s fragile grip on the US House of Representatives – and possibly the Senate, experts said.

“For these reasons”, Fortunato said, “China does not feel compelled to rush to the negotiating table to secure a trade deal. That will probably fall to Trump.”",https://www.aljazeera.com/news/2025/4/28/trump-china-tariff-war-whos-winning-so-far
tariffs,Chinese export hike reported as tariff talks with US set to start,"China reported that its exports rose more than expected in April as it prepares for weekendtalksover tariffs with the United States.

Outbound shipments from the world’s second-largest economy registered a year-on-year rise of 8.1 percent last month, according to government data published on Friday. The result was substantially higher than the 2 percent predicted by economists amid thetrade warwith the US started by President Donald Trump.

The rise in overall exports in April came despite a 21 percent drop in sales to the US, after Trump announced a general tariff of 145 percent on Chinese goods.

China appears to have succeeded in efforts to pivot to other markets, said analysts.

“Reports of the death of China’s exports look to be greatly exaggerated,” said Lynn Song, chief economist for Greater China at Dutch bank ING. “However you slice it, the data looks better than most market participants expected.”

The figures may also have been buoyed by demand for materials from overseas manufacturers rushing out goods during a 90-day pause on the US tariffs.

Economist Zichun Huang, of Capital Economics, warned that China’s export growth could “turn negative” later this year, with exports to the US set for “further declines” over the coming months, “not all of which will be offset by increased trade with other countries”.

The data was released a day before China’s trade envoy He Lifeng is due to sit down with US Treasury Secretary Scott Bessent in the Swiss capital Geneva.

The talks will be the first official engagement between Beijing and Washington on trade sinceTrumpslapped the 145 percent tariff on Chinese goods, prompting a retaliatory 125 percent duty from China.

Ahead of the meeting, Trump floated the idea of an 80 percent tariff on Chinese goods as an alternative to the punitive 145 percent, saying that the amount “seems right”.

The Reuters news agency, quoting unnamed sources, reported that behind closed doors, Chinese officials have grown increasingly alarmed about the effect of the tariffs war on the economy, and the risk of isolation as China’s trading partners have started negotiating deals with Washington.







The lead-up to the Geneva talks has highlighted the different negotiating approaches on either side, with Trump reportedly pushing for direct talks with Chinese President Xi Jinping.

That proposal was rejected, partly because Beijing was spooked by Trump’s public berating of Ukrainian President Volodymyr Zelenskyy in February, according to one source quoted by Reuters.

According to the source, any unscripted hostile interaction between the US and Chinese leaders would be seen as an unacceptable loss of face for Xi.

“Both sides I think are balancing, trying to look tough with not wanting to be responsible for sinking the global economy,” said Scott Kennedy, an expert in Chinese business affairs at the Center for Strategic and International Studies in Washington.",https://www.aljazeera.com/news/2025/5/9/chinese-exports-rise-ahead-of-tariff-talks-with-us
