Keyword Searched,Title,Content,URL
tariffs,Trump-China trade war: Which US companies could be worst hit?,"From Apple to Nvidia, United States tech companies have received a temporaryexemptionfrom President Donald Trump’s sky-high tariffs. For other businesses, the damage imposed by existing levies on Chinese exports may prove fatal.

While Trump stepped back from the edge for most countries – announcing a 90-day pause on the bulk of his “reciprocal” tariffs onWednesday– he doubled down on China, eventually increasing import taxes on its goods to145 percent.

Trump has pitched his protectionist agenda as essential for reviving US industry. However,many US firmshave grown used to cheap imports from China. For many of them, prices will rise and profits will fall.

Beijing has also responded to Trump’s moves withretaliatory tariffs of its own, now at 125 percent. US exports to China, and agricultural products in particular, will be hit badly by China’s blanket levy.

Here is the state of trade ties between the world’s two largest economies and the US companies that could be worst affected:

Despite growing tensions between the US and China, Washington and Beijing remain major trading partners.

According to data from the Office of the US Trade Representative, the total goods trade between the US and China stood at $582.4bn in 2024. After Canada and Mexico, China is America’s third largest trading partner.

US imports from China totalled $438.9bn while its exports the other way tallied in at $143.5bn. The upshot is that the US trade deficit with China was $295.4bn last year, bigger than for any other country.

On Friday, China’s Ministry of Commerce said it was increasing tariffs on US goods from 84 percent to 125 percent, reiterating that Beijing would “fight to the end” shortly after Washington raised US duties on Chinese imports to 145 percent.

Late that same day, the Trump administration announced temporary exemptions for smartphones, solar panels and other electronic products like semiconductor chips – most of which are made in China – from Trump’s “reciprocal” tariffs, which he has said are meant to level the playing field with trading partners who impose duties on US goods and run trade surpluses with the US.

China’s governmentwelcomed the exemptionsand urged Trump to go further. However, the US president has said those products will ultimately be subject to their own different levy. As of now, they are still subject to the 20 percent tariffs that Trump imposed on all Chinese goods before April 2.

In the meantime, companies will be forced to pass down at least some of Trump’s tariffs onto consumers to try to preserve their profit margins. That will result in higher inflation and lower business output.

According to an analysis from the Yale Budget Lab, tariffs could cause 740,000 people to lose their jobs across the US by the end of 2025. But which sectors will be most exposed to these trade disruptions?

The price of Nike trainers, Levi jeans and Gap T-shirts will almost certainly rise in the US as tariffs undermine the Asian factory hubs that underpin the global clothing industry.

In 2024, factories in China, Vietnam and Indonesia made 95 percent of all Nike footwear. Trump has already introduced 145 percent tariffs on China while Vietnam and Indonesia currently face 10 percent tariffs, which could go up in July if they don’t succeed in striking a trade deal with Washington by then.

Vietnam, in particular, is seen as a major indirect source of Chinese imports, both by rerouting Chinese goods through Vietnamese ports and by using Chinese parts in its exports to the US.

Gap is also highly exposed to production processes in Vietnam. Since Trump’s “reciprocal” tariff announcement on April 2, Gap shares have fallen by 14 percent. For Nike, it’s 14.7 percent.

Elsewhere, Levi’s stock price has plunged by 10.6 percent.

On Friday night, US Customs and Border Protection (CBP) issued a notice exempting some technology products from the tariffs placed on Chinese goods.

The CBP listed 20 product categories, including computers, smartphones and automatic data processors. It also included semiconductor equipment, memory chips and flat panel displays.

The exemptions were a welcome relief to major technology firms, including Apple, which relies heavily on Chinese manufacturing. But even with all post-April 2 tariffs on them waived for now, these electronic goodsstill face 20 percent tariffsthat Trump had imposed on them before April 2.

Trump has also said the exemptions are temporary, and new tariffs might be coming soon. Additionally, on Monday he announced an investigation into the national security implications of importing semiconductors and chip-making equipment, injecting new insecurities for electronics firms.

Supply chains in general are hard to move. For electronic goods, they are particularly difficult to replace – lining up industrial processes across different locations requires time and investment.

Bradley Saunders, a North America analyst at Capital Economics, told Al Jazeera that technology goods assembly processes have been “built up over years. … Markets have found the most efficient supply chains that they can.”

For now, Apple outsources most of its assembly operations to China. Smartphone companies are not alone. Almost 90 percent of gaming consoles sold in the US by Sony, Microsoft and Nintendo have been shipped in from China.

Elsewhere, Nvidia relies heavily on components from China. The technology giant relies on Taiwan Semiconductor Manufacturing Company to manufacture its cutting-edge graphics cards and AI chips.

Apple and Nvidia led a broad advance across US stock markets after Trump announced his recent exemptions. According to Saunders, any new tariffs could hit US technology sectors “hard”.

Trump’sfirst trade war with Chinafrom 2018 to 2019 resulted in billions of dollars of lost revenue for American farmers. “The agriculture industry always tends to lose out in trade wars,” Saunders said.

He pointed out that “about 15 percent” of US farm exports went to China in 2024. Thesoya bean sector, in particular, stands to lose because China is its largest export market.

When Trump imposed tariffs on Chinese goods in his first presidential term, Beijing retaliated by buying soya beans from other countries like Brazil. It also imposed retaliatory tariffs of its own. This time around, those tariffs are five times higher.

The American Soybean Association has publicly opposed Trump’s tariffs on China, and soya bean farmers have warned that many in the industry could go out of business if the trade war continues.

The US hasmore than 500,000 soya bean producers, according to the Department of Agriculture’s Census of Agriculture. That includes at least 223,000 full-time jobs supported by the soya bean industry, according to a 2023 report for the National Oilseed Processors Association and the United Soybean Board.

The industry is worth $124bn in the US. That’s more than the entire economy of Kenya or Bulgaria.

Corn and pig farmers have also been urging the Trump administration to step back from its tariff spat. Cargill, Archer Daniels Midland and Tyson Foods are three of several large US food companies that will likely lose export earnings from China.",https://www.aljazeera.com/news/2025/4/15/trump-china-trade-war-which-us-companies-could-be-worst-hit
tariffs,"Trump moves closer to semiconductor tariffs, floats pause on auto duties","United States President Donald Trump has advanced plans to introduce tariffs on semiconductors and pharmaceutical products, even as he floated the possibility of a reprieve from his duties on the auto industry.

In the latest flurry of trade announcements on Monday, the Trump administration launched investigations into the national security implications of importing the goods and related products, including chip-making equipment and pharmaceutical ingredients.

The probes follow Trump’s remarks over the weekend that he would announce the details of new tariffs on semiconductors within days, afterhis administration exemptedthe chips and other high-tech goods from his “reciprocal” tariffs unveiled on April 2.

The investigations are the latest trade-related probes initiated by the US under Section 232 of the Trade Expansion Act, which the Trump administration has also used to scrutinise imports of copper, lumber, steel andaluminium.







Semiconductors are crucial to the manufacturing of almost all modern electronics.

The US is heavily dependent on semiconductorimports from Asia, especially Taiwan, though Trump, like his predecessor Joe Biden, has been pushing companies to make more of the chips domestically.

In an announcement that was hailed by the White House as an example of Trump’s trade policies in action, chip giant Nvidia on Monday said that it would spend up to $500bn building its artificial intelligence super computers on US soil for the first time.

Trump’s move towards new tariffs on chips and pharmaceuticals raises the prospect of fresh turmoil for businesses and financial markets around the globe, which have been roiled by the US president’s dizzying back-and-forth announcements on trade.

After announcing a90-day pauseon most of his “reciprocal” tariffs against dozens of trade partners last week, Trump raised the rate of duties on imports from China to 145 percent.

China has, in turn, slapped US imports with atariff of 125 percent, while pledging to “fight to the end” if Washington continues to escalate its trade war.

Financial markets and businesses have been waiting for signs that Trump’s tariffs will be watered down or dropped outright if the administration can extract concessions from its trading partners.

In an interview with Fox Business on Monday, Kevin Hassett, Trump’s top economic adviser, said that officials were making “astonishing” progress in their negotiations with US trading partners and had received “amazing offers” from more than 10 countries.

Hassett did not specify which countries the US was making progress with.







On Monday, Trump suggested that he could offer automakers some relief from his 25 percent tariffs on vehicles and auto parts to give them time to adjust their supply chains.

“I’m looking at something to help some of the car companies, where they’re switching to parts that were made in Canada, Mexico and other places, and they need a little bit of time, because they’re going tomake them here,” Trump told reporters at the White House.

“I’m a very flexible person. I don’t change my mind, but I’m flexible, and you have to be,” Trump added.

US stocks, which have been on a rollercoaster ride amid Trump’s tariff announcements, rose higher on Monday, with the benchmark S&P500 and tech-heavy Nasdaq Composite gaining 0.79 percent and 0.64 percent, respectively.

Asian markets rose on Tuesday morning, with Japan’s Nikkei 225 and South Korea’s KOSPI up 1.16 percent and 0.67 percent, respectively, as of 02:00 GMT.",https://www.aljazeera.com/economy/2025/4/15/trump-moves-to-put-tariffs-on-chips-and-drugs-floats-pause-on-auto-duties
tariffs,"Trump delays Canada tariffs, but anger and calls to rethink US ties persist","Montreal, Canada –Canada has experienced a tumultuous start to 2025, with Prime Minister Justin Trudeauannouncing his resignationdays into the new year, a federal election looming, and the country’s affordability crisis deepening.

Now, Canada is facingwhat some economistshave dubbed “its largest trade shock in nearly 100 years”.

United States President Donald Trump has threatened to impose 25-percent tariffs on a wide range of Canadian imports and 10-percent tariffs on Canadian energy.

While the measures were set to begin on Tuesday, Trudeau said on Monday afternoon that the US tariffs and retaliatory measures announced by his government would be delayed by “at least 30 days” as the countries work together on border security.

Yet for many across the country, the potential fora trade warbetween the longtime allies continues to fuel a sense of anger, as well as anxiety and confusion over what is to come.

Trump’s threat of tariffshas also raised questions about the nature of the cross-border relationship and spurred calls for Canada to boost in-country trade while looking beyond the US for more reliable international partners.

“It’s very, very worrisome right now for workers,” Lana Payne, the national coordinator of Unifor, Canada’s largest private-sector union, told Al Jazeera before the tariff delay was announced.

“A lot of concern, a lot of worry, a lot of uncertainty — they’re feeling all of it,” she said in a phone interview on Monday.

“But I would also say… they are feeling angry right now that the United States would do this to the Canadian economy, would do this to Canadian workers, considering our long history of working together.”







The US and Canada have enjoyed close political and trade ties for decades.

Last year, the US exported more than $322bn in goods to Canada, according toUS Census data. It also imported more than $377bn worth of products from its northern neighbour.

Nearly three-quarters of Canada’s total trade exports go to the US. The country is also the US’s largest foreign energy supplier, with about 97 percent of Canadian crude oil exports going south of the border in 2023.

But Trump, who has routinely criticised Canada since he won re-election in November,has saidthe tariffs are necessary to push the Canadian government to stop fentanyl trafficking and irregular migration across its border with the US.

He has also argued that the tariffs seek to make up for a trade deficit with Canada, which he has dubbed a “subsidy”.

“We pay hundreds of Billions of Dollars to SUBSIDIZE Canada. Why? There is no reason. We don’t need anything they have. We have unlimited Energy, should make our own Cars, and have more Lumber than we can ever use,” the US president recently wrote on social media.

Trudeau has hit back, announcing retaliatory tariffs against about $106bn (155 billion Canadian dollars) of US goods on Saturday. Of that, about $20bn (30 billion Canadian dollars) was set to be imposed on Tuesday.

“We will stand strong for Canada. We will stand strong to ensure our countries continue to be the best neighbours in the world,” Trudeau said.

But on Monday afternoon, the Canadian prime minister announced the proposed tariffs would be paused “for at least 30 days” after he had a “good call” with Trump.

Canada will “appoint a Fentanyl Czar, we will list cartels as terrorists, ensure 24/7 eyes on the border, launch a Canada-US Joint Strike Force to combat organized crime, fentanyl and money laundering”, among other measures, Trudeau said.

I just had a good call with President Trump. Canada is implementing our $1.3 billion border plan — reinforcing the border with new choppers, technology and personnel, enhanced coordination with our American partners, and increased resources to stop the flow of fentanyl. Nearly…

— Justin Trudeau (@JustinTrudeau)February 3, 2025



Asa McKercher, a professor at St Francis Xavier University who studies Canada-US relations, said the two countries have experienced tensions in the past.

He pointed to tensions over Canada’s refusal to join the US-led invasion of Iraq in 2003 and personal animosities between former US President John F Kennedy and Canadian Prime Minister John Diefenbaker in the early 1960s.

But McKercher said the current trade tensions have plunged the relationship to its lowest point.

“We haven’t really seen the Americans go out of their way toimpose a policythat will just destroy the Canadian economy. That is the difference here,” McKercher told Al Jazeera.

He said that since Trump signed the order authorising tariffs against Canada and Trudeau unveiled reciprocal measures, there has been an uptick in nationalist sentiment in Canada.

Canadian crowds booed the US national anthem athockey and basketball gamesover the weekend, while the leaders of several provinces have urged people to “buy Canadian” in response to the tariffs.

“Some people are reacting in the only ways they can, which is booing American hockey teams and not buying Kellogg’s cereal because it’s made in America,” he said.

For the average person, McKercher explained, those “little acts of defiance” offer “a sense of agency” in a situation where they might otherwise feel powerless.

“We’re really subject to the whims of a guy in the White House, and that’s a very scary thing.”

At a small fruit-and-vegetable shop in Montreal on Monday morning, shoppers Patricia and Lorraine were looking for an avocado — but they had to make sure it was not from the US.

“It’s creating a lot of anxiety for everyone, I think,” Patricia, who only gave Al Jazeera her first name, said of the looming tariffs. “Even the atmosphere in general: The prices will go up, it will change our pace of life.”

“We have to boycott [US products]. We have to,” Lorraine said as the pair left the shop.

“We don’t have a choice,” Patricia added.

The shop’s owner, Amine Mulhim, said he was waiting to see how the potential tariffs would affect his business. He told Al Jazeera that he already largely sells local goods, but during the winter months, a greater portion of the produce comes from the US and Mexico.

“Already, everything is expensive,” he said.

A few blocks away, at a provincial liquor store, customer Angelo Baaco was adding US wines to a small shopping cart. The Quebec governmenthad saidthat US alcohol will be taken off the shelves as of Tuesday.

“It’s just stuff that I’m not going to be able to get in the next few months, or who knows how long. So I figured, ‘OK, might as well get this,'” Baaco said, reaching for a red wine from California. “I’m going to grab another one, just in case.”

Yet the threat of a prolonged trade war goes beyond day-to-day purchases. For many Canadians — including those living in poverty and homelessness — the prospect could make analready difficult economic situationworse.

Georges Ohana — the director of homelessness prevention at the Old Brewery Mission, a support and advocacy organisation in Montreal — said his greatest concern is a potential loss of jobs as a result of the US tariffs.

“That can compound what has already been a very difficult start to the year in terms of inflation,” he told Al Jazeera.

Already, Ohana said there has been an increase in demand for food banks and shelter beds in recent years in Montreal. Rental costs in the city have also skyrocketed, making affordable housing harder to find.

“When you compound these different systems, it makes it more difficult for homeless men and women, people that are vulnerable, people that have trauma, to be able to get the necessary help they need,” he said.

But, Ohana added, “I don’t think we should jump to conclusions [on tariffs]. I think we should wait to see how this fares out.”

Even as Canada appears to have secured a reprieve from US tariffs — at least for now — many Canadians have expressed anger at Trump’s repeated threats against their country.

Last week, political, labour and civil society leadersreleasedthe “Pledge for Canada” to build a nationwide response to the Trump administration’s policies.

That includes protecting Canadian sovereignty, reducing the country’s “dependence on the United States by diversifying our trade”, and building alliances with other countries, including on climate action, humanitarian aid and advancing democracy.

“It’s becoming very clear that to build resiliency for Canada in this increasingly turbulent world, it means actually lessening our dependency on our southern neighbour,” lawmaker Charlie Angus of the New Democratic Party said during anews conferenceannouncing the campaign.

According to Payne at Unifor, a threat of tariffs — which Canada has experienced for weeks, since Trump first made his plan known in November — remains dangerous on its own.

“It causes industry to pause on investments. It causes industry to divert investment to the United States. It causes industry to cancel investments because tariffs make it more expensive for them to operate,” she explained.

But she said Trump’s tariff threat also has created an understanding in Canada that the country must review all of its economic and trade policies, including procurement processes, infrastructure projects and natural resource development.

“All of that is on the table in a way that it has not been on the table in a very long time,” she told Al Jazeera.

“There is a great appetite for this right now because there is a sense … that we no longer have a friend the way that we thought that we did, and a stable trading partner,” Payne added.

“We have a president that rips up trade agreements. We have a president that threatens us daily with measures that would throw our economy into a recession. These are not the actions of an ally.”





",https://www.aljazeera.com/news/2025/2/3/trump-delays-canada-tariffs-but-anger-and-calls-to-rethink-us-ties-persist
