Keyword Searched,Title,Content,URL
tariffs,"Why did Trump pause Canada, Mexico tariffs? Inside 24 hours of chaos","United States President Donald Trumpannouncedthat he would “immediately pause” tariffs on Mexico and Canada for 30 days after speaking with their leaders on Monday.

However, a 10 percent tariff on all China exports comes into effect on Tuesday.

So what led to this decision, and why was the pause announced?

On February 1, Trump signed executive orders imposing 25 percent tariffs on Mexico and Canada, with a partial exemption for Canadian energy and oil exports, and a 10 percent tariff on China.

Trump has also spoken against the high trade deficit in goods with the three countries that together stands at more than $480bn. China, Mexico, and Canada collectively made up more than 40 percent of US imports of goods last year at $1.2 trillion.

He said these tariffs would remain in place until the countries took steps to curb the flow of migrants and drugs, particularly fentanyl, into the US. The tariffs risked increasing the cost of online goods and prompted global market uncertainty over the risk of a sharp slowdown in global growth.

However, on Monday, the leaders of Mexico and Canada struck last-minute deals, pausing the impending tariffs.

Mexico’s President Claudia Sheinbaum announced the deployment of 10,000 National Guard officers to the border to curb drug trafficking and migrants into the US after speaking with Trump.

Canadian Prime Minister Justin Trudeau also had two calls with Trump after which he announced a 30-day pause in the US tariffs. In return, Canada has agreed to send forces to the border to fight drug trafficking and undocumented migration as demanded by the new US administration.

Meanwhile, the 10 percent tariff Trump imposed on China took effect at 12:01am EST (05:01 GMT) on Tuesday.

China imposed retaliatory tariffs on a range of US goods and products, including a 15 percent levy on imports of coal and liquefied natural gas (LNG). Beijing also slapped 10 percent tariffs on crude oil imports and farm equipment.

Amid the tariff war, Trump said he intends to speak with Chinese President Xi Jinping in the coming days.

I just had a good call with President Trump. Canada is implementing our $1.3 billion border plan — reinforcing the border with new choppers, technology and personnel, enhanced coordination with our American partners, and increased resources to stop the flow of fentanyl. Nearly…

— Justin Trudeau (@JustinTrudeau)February 3, 2025



According to experts, the primary objective of the tariffs was “to strategically meet the goals of Trump’s foreign policy and domestic policy, and that was to stopthe flow of the illegal drug fentanylinto the United States”, Al Jazeera’s Kymberly Halkett reported from the White House.

“You have to remember fentanyl is responsible for approximately 70,000 overdose deaths in the US each year. While much attention has been focused on Mexico and the southern border, US officials have also identified Canada and the northern border as key entry points for the drug,” Halkett added.

According to a report by The New York Times, in 2024, US Customs and Border Protection agents seized approximately 19kg (42 pounds) of fentanyl at the northern border, a stark contrast to the nearly 9,600kg (21,164 pounds) intercepted at the US-Mexico border, where cartels mass-produce the drug.

Canada’s McGill University professor of economics Julian Karaguesian suggests that this dispute may not be over.

“It’s possible that President Trump was just trying to not only make a show but actually fulfil a campaign promise and create a flurry of activity to show his base and to show the wider American public that he is not only fulfilling his campaign promises but he is doing it with extreme prejudice,” Karaguesian said.







Trump has repeatedly criticised China for allowing fentanyl to flood into the US, accusing Beijing of not doing enough to curb the supply of both counterfeit and real fentanyl.

China has called the fentanyl crisis “America’s problem”.

“China is one of the world’s toughest countries on counter-narcotics both in terms of policy and its implementation. Fentanyl is an issue for the US. In the spirit of humanity and goodwill, China has given support to the US’s response to this issue,” a Chinese Ministry of Foreign Affairs spokesperson said in a release on Tuesday.

“It’s important to remember that the PRC [People’s Republic of China] was already facing tariffs imposed by the Trump administration during his first term, and the Biden administration never removed them. These new tariffs come on top of those existing measures,” Ja Ian Chong, from the National University of Singapore, told Al Jazeera.

“So far, China has responded relatively calmly, suggesting that a 10 percent tariff is something they can withstand. While the PRC economy has slowed, they have been working to diversify into other markets and boost domestic consumption. We will have to see how that strategy unfolds,” he added.

During his first term in 2018, Trump launched a fierce two-year trade war with China, imposing tit-for-tat tariffs on about $50bn worth of Chinese imports.

“We have a tremendous intellectual property theft problem,” Trump said in 2018. “It’s going to make us a much stronger, much richer nation.”

To end that trade war,China agreed in 2020to increase its annual purchases of US goods by $200bn, but the plan was disrupted by the COVID-19 pandemic, and Washington’s annual trade deficit with China remained above $300bn, according to Chinese customs data released last month.

China, the world’s second-largest economy, says the “unilateral tariff hike” by the US “seriously violates World Trade Organization rules”. It also launched an anti-monopoly investigation into Google and imposed controls on rare earth exports crucial for the manufacture of semiconductors.

It is not quite clear yet. But analysts say the Trump administration would likely hold negotiations with Mexico in the next 30 days.

“The big concern for Donald Trump is the flow of illegal substance fentanyl as well as illegal immigration into the United States, something that the US president addressed already through an executive order,” Al Jazeera’s Halkett said.

The Al Jazeera correspondent said US officials are going to negotiate the trade deficit with Mexico over the next month. The US trade deficit with Mexico stands at more than $100bn.

At the northern border, Trump said he was very pleased with the outcome of the negotiations, but he was also looking for a “final economic deal”.

“I am very pleased with this initial outcome, and the tariffs announced on Saturday will be paused for a 30 day period to see whether or not a final economic deal with Canada can be structured,” Trump posted on social media. “FAIRNESS FOR ALL!”

Trump has also expressed interest in Canada becoming the 51st state of the US, a notion that Trudeau has rejected.

On Monday, Canada also made important announcements.

“Canada had agreed to name Mexican drug cartels as terrorist organisations. We’re going to name a fentanyl ‘tsar’ as a result of the conversation between Prime Minister Trudeau and President Trump. There is the creation of a Canada-US joint strike task force to combat organised crime,” Canada’s McGill University professor of economics Julian Karaguesian said.

“While those commitments by Canada have been successful in getting a one-month delay in the imposition of tariffs,” Karaguesian said, “I don’t personally believe this is the end of the story.”",https://www.aljazeera.com/economy/2025/2/4/why-did-trump-pause-canada-mexico-tariffs-inside-24-hours-of-chaos
tariffs,"How have Canada, China and Mexico responded to Trump’s tariffs?","US President Donald Trump has pushed into new trade law territory with an emergency sanctions law to justify punishing tariffs on Canadian and Mexican imports and an extra duty on Chinese goods.

Trump signed three separateexecutive orderson Saturday, imposing the tariffs, which have beenglobally criticised.

Here’s what you need to know about Trump’s tariffs and how the affected countries have retaliated.

It imposes a 10 percent bill on all imports from China and a 25 percent levy on goods from Mexico and Canada.

One exception to this is Canadian energy products, including oil, natural gas and electricity, which will be taxed at 10 percent.

The tariffs come with no exceptions, according to White House officials – and would even apply to Canadian imports values less than $800, which are currently duty-free.

Trump invoked the International Emergency Economic Powers Act (IEEPA) to impose the taxes, accusing the targeted countries of not doing enough to stop illegal immigration or drug trafficking into the United States.

The aim is to hold them “accountable to their promises of halting illegal immigration and stopping poisonousfentanyland other drugs from flowing into our country”, the White House said in a statement.

The action makes good on Trump’s repeated campaign threat to impose widespread tariffs, a policy he defends and believes helps generate revenue, protect American jobs and create leverage.

The word “tariff”, Trump has often joked, “is themost beautiful wordin the dictionary”.

Trump has repeatedly said he would like to see Canada become the “51st state”, and in January at the World Economic Forum in Davos, Switzerland,Trump called out his country’s northern neighbour.

“We have a tremendous deficit with Canada. We’re not going to have that any more. We can’t do it,” Trump said, teasing another way to avoid the tariffs.

“As you probably know, I say: ‘You can always become a state. And then, if you are a state, we won’t have a deficit. We won’t have to tariff you,’” Trump said.

Tariff collections are to begin at 12:01am EST (05:01 GMT) on Tuesday, according to Trump’s executive orders. But imports that were loaded onto a vessel or onto their final mode of transit before entering the US prior to 12:01am Saturday would be exempt from the duties.

The taxes will stay “until the crisis alleviated”, according to the White House, which provided no specific benchmarks needed for them to be lifted.







Canada’s Prime Minister Justin Trudeau begrudgingly announced Ottawa would respond in kind, putting 25 percent tariffs on up to $155bn in US imports.

Those tariffs would include American beer, wine and bourbon, as well as fruits and fruit juices, including orange juice from Trump’s home state of Florida, said Trudeau. Canada would also target goods including clothing, sports equipment and household appliances.

Trudeau questioned why Trump would threaten a historic US-Canada partnership that he said is the strongest “the world has ever seen”.

According to the US government, Canada was the largest buyer of the country’s goods in 2022, accounting for $356.5bn in purchases. An estimated$2.7bnworth of goods and services crossed the US-Canada border each day in 2023.

“The actions taken today by the White House split us apart instead of bringing us together,” said Trudeau. “We didn’t ask for this, but we will not back down.”

Mark Carney, a frontrunner to replace Trudeau as Canada’s next premier, also slammed the Trump tariffs and said Canada would be “united” and “stand up to a bully”.

President Trump thinks we’re pushovers. He doesn’t know Canadians.

We will stand up for our country. We will stand united. We will get stronger. Together.pic.twitter.com/XyPItjuWkP

— Mark Carney (@MarkJCarney)February 2, 2025



Mexican President Claudia Sheinbaum on Saturday ordered retaliatory tariffs in response to the tariffs on all goods coming from Mexico.

In a lengthy post on X, Sheinbaum said her government sought dialogue rather than confrontation with its top trade partner to the north, but that Mexico had been forced to respond in kind.

“I’ve instructed my economy minister to implement the plan B we’ve been working on, which includes tariff and non-tariff measures in defence of Mexico’s interests,” Sheinbaum posted, without specifying what US goods her government will target.

The US is by far Mexico’s most important foreign market, and Mexico in 2023 overtook China as the top destination for US exports.

Mexico has been preparing possible retaliatory tariffs on imports from the US, ranging from five percent to 20 percent, on pork, cheese, fresh produce, manufactured steel and aluminium, according to sources familiar with the matter. The auto industry would initially be exempt, they said.

Economy Minister Marcelo Ebrard said on X that Trump’s tariffs were a “flagrant violation” of the US-Mexico-Canada Agreement — which Trump had himself shepherded in his first term, as a substitute for the North American Free Trade Agreement.

“Plan B is under way,” Ebrard said. “We will win!”

US exports to Mexico accounted for more than $322bn in 2023, Census Bureau data showed, while the US imported more than $475bn worth of Mexican products.

In her post, Sheinbaum also rejected as “slander” the White House’s allegation that drug cartels have an alliance with the Mexican government, a point Trump’s administration used to justify the tariffs.







China’s government has denounced the tariffs and Trump’s demand that Beijing needed to staunch the flow of fentanyl, a deadly opioid, into the US, while leaving the door open for talks with the US that could avoid a deepening conflict.

Beijing will challenge Trump’s tariff at the World Trade Organization (WTO) – a symbolic gesture – and take unspecified “countermeasures” in response to the levy, which takes effect on Tuesday, China’s Finance and Commerce Ministries said.

That response stopped short of the immediate escalation that had marked China’s trade showdown with Trump in his first term as president and repeated the more measured language Beijing has used in recent weeks.

China’s toned-down response marked a contrast with the direct retaliation and heated language from Canada and Mexico.

China’s Commerce Ministry said in a statement that Trump’s move “seriously violates” international trade rules, urging the US to “engage in frank dialogue and strengthen cooperation”.

Filing a lawsuit with the WTO could give Beijing a win in messaging by standing up for the rules-based trading system long advocated by US administrations of both parties. Beijing has taken the same step in a challenge to tariffs of up to 45 percent on Chinese-made electric vehicles by the European Union.

At the same time, a WTO appeal poses no immediate cost or threat to Washington.

China’s sharpest pushback was over fentanyl, an area where the administration of former US President Joe Biden had also been urging Beijing to crack down on shipments of the China-made precursor chemicals needed to manufacture the drug.

“Fentanyl is America’s problem,” China’s Foreign Ministry said. “The Chinese side has carried out extensive anti-narcotics cooperation with the United States and achieved remarkable results.”







The closest parallel to Trump’s action was the late President Richard Nixon’s use of IEEPA’s predecessor law, the 1917 Trading With the Enemy Act, to impose a 10 percent across-the-board US tariff in 1971 to stem rising imports amid a balance-of-payments crisis after pulling the dollar off the gold standard.

Courts upheld Nixon’s action, but Jennifer Hillman, a trade law professor at Georgetown University and former World Trade Organization appellate judge, said Trump’s action may not fit the emergency.

The Nixon ruling and reporting requirement language in the IEEPA statute suggest that there needs to be a causal connection between the emergency – fentanyl and migrants – and the remedy: universal tariffs on Canada, Mexico and China.

“At least for me, I don’t think there is such a connection in this case,” Hillman said. “The tariffs would not be applied only to fentanyl, so there is not a clear reason why tariffs on all goods are ‘necessary’ to deal with a problem of fentanyl or migrants.”

Nixon’s use had a much clearer connection between the level of imports and the value of the dollar, she added.

Economic experts say the tariffs are likely to slow economic growth for all parties, while likely driving up inflation.

“Until now the market has really been on Trump’s side, but this is something where that could change and the market could challenge him for the first time,” said Mark Malek, chief investment officer of Siebert Financial in the US.

A new analysis by the Budget Lab at Yale laid out the possible damage to the US economy, saying the average household would lose the equivalent of $1,170 in income from the taxes.

Economist and former US Treasury Secretary Lawrence Summers said that jobs in the “industrial heartland will be lost as American producers can’t compete due to higher input costs”.

He said on X that Canada and Mexico will lose trust in the US and that the effect on the supply chain will be a “strategic gift” for China.

“Bullying doesn’t win over time on the playground or in the international arena,” Summers said.",https://www.aljazeera.com/news/2025/2/2/how-have-canada-china-and-mexico-responded-to-trumps-tariffs
tariffs,Trump tariffs updates: US ‘not looking at’ pausing tariffs for trade talks,This live page is now closed.,https://www.aljazeera.com/news/liveblog/2025/4/7/trump-tariffs-live-asian-european-shares-plunge-as-shockwaves-spread
tariffs,US suspends tariffs against French goods over digital service tax,"The United States says it will hold off slapping tariffs on French cosmetics, handbags and other imports in retaliation for a digital services tax (DST) Washington says will harm US technology firms, while it investigates similar taxes elsewhere.

The US Trade Representative’s (USTR) office said on Thursday the 25 percent tariffs on imports of the French goods, which are valued at approximately $1.3bn annually and were due to go into effect on Wednesday, would be suspended indefinitely.

Washington had announced the tariffs in July after a US investigation showed a DST unfairly singled out US companies such as Google, Facebook, Apple, and Amazon.

France and other countries view digital service taxes as a way to raise revenue from the local operations of big tech companies which they say profit enormously from local markets while making only limited contributions to public coffers.

USTR said suspending the action against France would allow Washington to pursue a coordinated response in 10 investigations into similar taxes in India, Italy, Britain and other countries. It gave no timeframe for further action.

European leaders and industry groups welcomed the news, saying it would allow more time for talks on a global taxation solution to bear fruit.

“The US Trade Representative has decided to suspend the tariffs in light of the ongoing investigation of similar DSTs adopted or under consideration in ten other jurisdictions,” the agency said in a statement, adding it had not yet determined possible trade actions in the other cases.

French Finance Minister Bruno Le Maire said the tariffs would not have been “legitimate” under World Trade Organization rules in any case and redoubled his call for a global solution.

“Trade disputes between the United States and Europe … will only make losers, particularly during this time of crisis,” he said.

EU Trade Commissioner Valdis Dombrovskis emphasised Brussels’s willingness to work on a global solution for fair taxation of the sector.

“The EU stands ready to explore all options should the US unilaterally apply these trade measures,” he said.

The reprieve gives US President-elect Joe Biden and his nominee as trade tsar, Katherine Tai, time to work with France and other countries to find a multilateral solution, said Coalition of Services (CSI) Industries.

CSI President Christine Bliss also urged France and other countries named in the USTR investigation to suspend imposition of DSTs and continue working towards a solution.

Nearly 140 countries involved in talks agreed in October to keep negotiating until mid-2021 after discussions stalled as Washington became reluctant to sign up to an international deal ahead of last November’s US presidential election.

The USTR on Wednesday said it had found that digital services taxes adopted by India, Italy and Turkey also discriminated against US companies and were inconsistent with international tax principles, but held off on announcing any specific tariff actions.

The investigations are among several active USTR probes that could lead to tariffs before President Donald Trump leaves office or early in the Biden administration.",https://www.aljazeera.com/economy/2021/1/8/us-suspends-tariffs-against-french-goods-over-digital-service-tax
